{
  "@context": "https://schema.org",
  "@type": "ItemList",
  "name": "SovereignSky Geopolitical Blocs",
  "description": "Regional and supranational data governance frameworks affecting digital sovereignty",
  "filterValues": ["low", "moderate", "elevated", "high", "sanctioned"],
  "itemListElement": [
    {
      "@type": "Organization",
      "identifier": "eu",
      "name": "European Union",
      "alternateName": "EU",
      "flag": "üá™üá∫",
      "legalType": "Supranational",
      "localizationRequired": "High (Sensitive/Public/AI)",
      "description": "The EU's comprehensive data framework expanded in 2026 to include the AI Act and Data Act, creating a 'Digital Single Market' with binding rules across all 27 member states.",
      "memberOf": ["AT", "BE", "BG", "HR", "CY", "CZ", "DK", "EE", "FI", "FR", "DE", "GR", "HU", "IE", "IT", "LV", "LT", "LU", "MT", "NL", "PL", "PT", "RO", "SK", "SI", "ES", "SE"],
      "laws": ["gdpr", "data-act", "ai-act", "dsa", "dma"],
      "riskLevel": "low",
      "abstract": "Supranational bloc with the world's most integrated digital laws.",
      "summary": "In 2026, the EU shifted focus from mere privacy (GDPR) to ethical AI deployment and mandatory interoperability for cloud services. It is the primary regulator for global digital standards.",
      "articleBody": "The 'Brussels Effect' reached its peak in 2026 with the AI Act becoming fully enforceable in August. This law mandates transparency for general-purpose AI and prohibits high-risk biometric surveillance, influencing how data is processed globally.",
      "image": "https://example.com/images/blocs/eu-digital-2026.png",
      "adequacyDecisions": [
        { "countryId": "AD", "countryName": "Andorra", "date": "2010-10-21", "scope": "full" },
        { "countryId": "AR", "countryName": "Argentina", "date": "2003-07-05", "scope": "full" },
        { "countryId": "CA", "countryName": "Canada", "date": "2001-12-20", "scope": "partial", "notes": "Commercial organizations under PIPEDA" },
        { "countryId": "FO", "countryName": "Faroe Islands", "date": "2010-03-05", "scope": "full" },
        { "countryId": "GG", "countryName": "Guernsey", "date": "2003-11-21", "scope": "full" },
        { "countryId": "IL", "countryName": "Israel", "date": "2011-01-31", "scope": "full" },
        { "countryId": "IM", "countryName": "Isle of Man", "date": "2004-04-28", "scope": "full" },
        { "countryId": "JP", "countryName": "Japan", "date": "2019-01-23", "scope": "full", "notes": "Mutual adequacy agreement" },
        { "countryId": "JE", "countryName": "Jersey", "date": "2008-05-08", "scope": "full" },
        { "countryId": "NZ", "countryName": "New Zealand", "date": "2012-12-19", "scope": "full" },
        { "countryId": "KR", "countryName": "South Korea", "date": "2021-12-17", "scope": "full" },
        { "countryId": "CH", "countryName": "Switzerland", "date": "2000-07-26", "scope": "full" },
        { "countryId": "GB", "countryName": "United Kingdom", "date": "2021-06-28", "scope": "conditional", "notes": "Subject to sunset clause review" },
        { "countryId": "UY", "countryName": "Uruguay", "date": "2012-08-21", "scope": "full" },
        { "countryId": "US", "countryName": "United States", "date": "2023-07-10", "scope": "partial", "notes": "Data Privacy Framework (DPF) certified organizations only" }
      ]
    },
    {
      "@type": "Organization",
      "identifier": "eea",
      "name": "European Economic Area",
      "alternateName": "EEA",
      "flag": "üá™üá∫",
      "legalType": "Economic Single Market",
      "localizationRequired": "High",
      "inheritsFrom": ["eu"],
      "description": "The EEA extends the EU single market rules, including GDPR and the 2026 AI Act, to Norway, Iceland, and Liechtenstein.",
      "memberOf": ["NO", "IS", "LI"],
      "laws": ["eea-agreement", "gdpr-eea-adoption"],
      "riskLevel": "low",
      "abstract": "Extends EU data sovereignty and single market standards to non-EU members.",
      "summary": "The EEA ensures that data flows between the EU and members like Norway are treated as internal transfers, provided the members adopt relevant EU acts into their domestic law.",
      "articleBody": "By early 2026, all EEA members have initiated the adoption of the EU AI Act. This maintains a 'frictionless' data zone for the entire European single market, allowing companies in Norway to operate under the same rules as those in Germany or France.",
      "image": "https://example.com/images/blocs/eea-integration.png"
    },
    {
      "@type": "Organization",
      "identifier": "asean-defa",
      "name": "ASEAN Digital Economy",
      "alternateName": "ASEAN DEFA",
      "flag": "üåè",
      "legalType": "Intergovernmental Pact",
      "localizationRequired": "Medium",
      "description": "The landmark 2026 Digital Economy Framework Agreement (DEFA) harmonizes digital trade and data flows for over 700 million people across SE Asia.",
      "memberOf": ["BN", "KH", "ID", "LA", "MY", "MM", "PH", "SG", "TH", "VN"],
      "laws": ["asean-defa-2026", "asean-model-clauses"],
      "riskLevel": "moderate",
      "abstract": "A massive 2026 regional pact unifying Southeast Asia's digital markets.",
      "summary": "Signed in early 2026, DEFA targets a $2 trillion digital economy by 2030. It sets the first binding regional rules for cross-border data flows and e-payment interoperability.",
      "articleBody": "ASEAN's approach in 2026 balances 'consensual sovereignty' with trade. DEFA allows countries like Indonesia to keep specific localization rules for financial data while standardizing rules for e-commerce and AI ethics across the bloc.",
      "image": "https://example.com/images/blocs/asean-defa.png"
    },
    {
      "@type": "Organization",
      "identifier": "gcc-trust",
      "name": "GCC Trust Zone",
      "alternateName": "GCC",
      "flag": "üèõÔ∏è",
      "legalType": "Regulatory Union",
      "localizationRequired": "Very High",
      "description": "Led by Saudi Arabia and the UAE, the GCC has unified its data privacy landscape, with Oman's PDPL becoming fully enforceable in February 2026.",
      "memberOf": ["SA", "AE", "QA", "KW", "BH", "OM"],
      "laws": ["saudi-pdpl", "uae-data-law", "oman-pdpl-2026"],
      "riskLevel": "moderate",
      "abstract": "High-trust digital region with strong emphasis on national data sovereignty.",
      "summary": "By 2026, the GCC has harmonized its privacy laws to facilitate regional digital trade. However, strict 'Strategic Data' residency requirements remain for government and energy sectors.",
      "articleBody": "The 2026 GCC landscape is defined by 'Digital Sovereignty' initiatives. While standard business data is transferable under new regional treaties, sensitive health and biometric data must remain localized in state-approved data centers.",
      "image": "https://example.com/images/blocs/gcc-2026.png"
    },
    {
      "@type": "Organization",
      "identifier": "five-eyes",
      "name": "Five Eyes",
      "alternateName": "FVEY",
      "flag": "üëÅ",
      "legalType": "Intelligence Alliance",
      "localizationRequired": "Low",
      "description": "A signals intelligence alliance between the US, UK, Canada, Australia, and New Zealand that enables high-level government data sharing.",
      "memberOf": ["US", "GB", "CA", "AU", "NZ"],
      "laws": ["us-cloud-act", "uk-ipa-2016"],
      "riskLevel": "elevated",
      "abstract": "Collaborative intelligence bloc with significant privacy implications.",
      "summary": "While not a trade bloc, the Five Eyes 2026 status indicates a region where government surveillance and mutual legal assistance can override commercial data privacy.",
      "articleBody": "The alliance uses instruments like the US CLOUD Act to access data across borders. In 2026, this continues to create friction with EU adequacy decisions, as 'mass surveillance' remains a core concern for European regulators.",
      "image": "https://example.com/images/blocs/fvey-intelligence.png"
    },
    {
      "@type": "Organization",
      "identifier": "au-dsm",
      "name": "AU Digital Single Market",
      "alternateName": "African Union DSM",
      "flag": "üåç",
      "legalType": "Continental Framework",
      "localizationRequired": "Medium",
      "description": "The African Union's 2026 roadmap focuses on the 'Continental Data Governance Framework' to ensure African data generates value within Africa.",
      "memberOf": ["DZ", "AO", "BJ", "BW", "BF", "BI", "CV", "CM", "CF", "TD", "KM", "CG", "CD", "CI", "DJ", "EG", "GQ", "ER", "SZ", "ET", "GA", "GM", "GH", "GN", "GW", "KE", "LS", "LR", "LY", "MG", "MW", "ML", "MR", "MU", "MA", "MZ", "NA", "NE", "NG", "RW", "ST", "SN", "SC", "SL", "SO", "ZA", "SS", "SD", "TZ", "TG", "TN", "UG", "ZM", "ZW"],
      "laws": ["afcfta-digital-protocol", "au-data-framework"],
      "riskLevel": "elevated",
      "abstract": "Continental initiative targeting 'Data Sovereignty' for African nations.",
      "summary": "By early 2026, the AfCFTA Digital Trade Protocol has begun harmonizing cross-border rules, aiming to prevent data fragmentation across the continent's 54 nations.",
      "articleBody": "The 2026 focus of the AU is 'Data Colonialism' prevention. The bloc encourages regional data centers and discourages the storage of strategic African population data on foreign soil without reciprocal agreements.",
      "image": "https://example.com/images/blocs/africa-union-digital.png"
    }
  ]
}
